{"association_evidence":"sha256:0f61af9a92dbaddbb0fee66b320142424120821974a7a46edeec50125d464383","fit_options":{"max_condition_number":10000000000,"max_distance":1000,"max_iterations":16,"max_reprojection_pixels":0.001,"max_speed":20},"hypotheses":[{"offset_ns":"50000000","skew_ppb":"-500000"},{"offset_ns":"50000000","skew_ppb":"0"},{"offset_ns":"50000000","skew_ppb":"500000"}],"reference_camera":{"calibration_digest":"sha256:429f0d694b6460b0fdda7e59c04c8e22343af99a3f1cce7d1c09d0e49f683c21","center":[-2,0,0],"clock":10,"id":1,"image_domain":"sha256:5d68272131df7e15e185ba961a18af9a51e095f00ddb6baf8ec4eb3931b79dee","intrinsics":{"cx":640,"cy":480,"fx":640,"fy":640,"height":960,"width":1280},"rotation":[[1,0,0],[0,1,0],[0,0,1]]},"schema":"fss.clock_drift_query.v1","target_anchor_ns":"50000000","target_camera":{"calibration_digest":"sha256:774581d9823f146940e6326de76474f8487d36c25542c76091ecc0fd492e9d38","center":[2,1,0],"clock":20,"id":2,"image_domain":"sha256:a9afa5b0df4c27568cd66dff7ebc9cd6ba19214e77cb8c0646a0e7f724b9240c","intrinsics":{"cx":640,"cy":480,"fx":640,"fy":640,"height":960,"width":1280},"rotation":[[1,0,0],[0,1,0],[0,0,1]]},"training":[{"camera":1,"capture_ns":"-10000000000","clock":10,"evidence_digest":"sha256:9fbb997209750a4d60378117ce9b998d97f37326238e65c170438afa6b1aceb2","exposure":"synthetic:1:-10000000000:drift","pixel":[801.1851851851852,508.44444444444446],"sigma_pixels":1,"source_digest":"sha256:9054b95254c5439c6371fc110adde0568106094b09507384219439749d66349a"},{"camera":1,"capture_ns":"-6000000000","clock":10,"evidence_digest":"sha256:0a2c71bb6167045d2f645baf3960ed32ae0597e3c81b3cad1dff7080d4caa5a4","exposure":"synthetic:1:-6000000000:drift","pixel":[821.2554744525547,504.2919708029197],"sigma_pixels":1,"source_digest":"sha256:306067c9ae6be4304abccc0dfbd64bd9fe1fffc3540b8058b70aa7a102790a25"},{"camera":1,"capture_ns":"-2000000000","clock":10,"evidence_digest":"sha256:7f62d0742976a257795945e5e27ddf2a9e31f35ea63f515faf137e75de09bfa6","exposure":"synthetic:1:-2000000000:drift","pixel":[840.7482014388489,500.2589928057554],"sigma_pixels":1,"source_digest":"sha256:154a42fb8e014be9e01969a2ebf5ed42eb8d8882bcd88aefaa3eb14da95d6961"},{"camera":1,"capture_ns":"2000000000","clock":10,"evidence_digest":"sha256:27ed2154b72a49ff07c96522947d83feeede184c0b5ab707a1f67e130a083e31","exposure":"synthetic:1:2000000000:drift","pixel":[859.6879432624114,496.3404255319149],"sigma_pixels":1,"source_digest":"sha256:d1bbd0545b7c6a917bfeff8f7c050adff7dabde826518b3b55dd7566b4269762"},{"camera":1,"capture_ns":"6000000000","clock":10,"evidence_digest":"sha256:806bb35e5de6d5b1aa3b41ab66d12211a6098a225b7c8b40edb84a282ba86323","exposure":"synthetic:1:6000000000:drift","pixel":[878.0979020979021,492.53146853146853],"sigma_pixels":1,"source_digest":"sha256:8776b44233b8ca4644c1d27694ca14b9929f8261611b8e42d709d73ea1b90a9a"},{"camera":1,"capture_ns":"10000000000","clock":10,"evidence_digest":"sha256:1b13d18654267d8edba635cf038385cc517014a0bcc19dc139e79c83f94da376","exposure":"synthetic:1:10000000000:drift","pixel":[896.0,488.82758620689657],"sigma_pixels":1,"source_digest":"sha256:2c0e3a9b7859b6d0fdc8efa7fbb4443441d7d1580c6549107e300033196e1b5b"},{"camera":2,"capture_ns":"-9955000000","clock":20,"evidence_digest":"sha256:9cfbabc0b8007237b9b61acac5fe747cdeda6378fc98f80c56dbb2acf5e60f2f","exposure":"synthetic:2:-10000000000:drift","pixel":[421.9259259259259,413.6296296296296],"sigma_pixels":1,"source_digest":"sha256:8181dee6f58f33db5249994a36f9c41308143a30d24c443a7cf9623606bc3744"},{"camera":2,"capture_ns":"-5953000000","clock":20,"evidence_digest":"sha256:782b4d89d7b6ba408ca65d0e8eb8058ad4e442d516654dd6e69625b7aa37b507","exposure":"synthetic:2:-6000000000:drift","pixel":[447.53284671532845,410.86131386861314],"sigma_pixels":1,"source_digest":"sha256:6762d3663bbc553d535505995e7c56451f79a1fddf0128a29ab6d3156487f55a"},{"camera":2,"capture_ns":"-1951000000","clock":20,"evidence_digest":"sha256:702fcd44cb20cd8a9985cf97f0eb063fd67ebca6a16bad26afdc162c0792ceab","exposure":"synthetic:2:-2000000000:drift","pixel":[472.40287769784175,408.1726618705036],"sigma_pixels":1,"source_digest":"sha256:736a5b5af6322f8757c1f7f2c6759b7ec04cdd40c660fc40eb7a1615ef369861"},{"camera":2,"capture_ns":"2051000000","clock":20,"evidence_digest":"sha256:3770b4d755898bfcc77525aa829f8e14a07ea0f1d96e3de8589a2144d6712273","exposure":"synthetic:2:2000000000:drift","pixel":[496.5673758865248,405.5602836879433],"sigma_pixels":1,"source_digest":"sha256:8e659d8697dc79137d1819905eaa8efb7ac677e69117ed842e45aeaea96efde8"},{"camera":2,"capture_ns":"6053000000","clock":20,"evidence_digest":"sha256:7ff93ea423c5667f2b4c0d8928266aafb2130155acba694f3d6ad96b3765a66e","exposure":"synthetic:2:6000000000:drift","pixel":[520.0559440559441,403.02097902097904],"sigma_pixels":1,"source_digest":"sha256:2836def291b3dfb606cada2f8874fe82c2a0c715126237f080508f16a6b9cc6e"},{"camera":2,"capture_ns":"10055000000","clock":20,"evidence_digest":"sha256:226e22f924fa4c210bdfccda4d612d58807283e464a68a90e0ccdffb44149442","exposure":"synthetic:2:10000000000:drift","pixel":[542.8965517241379,400.55172413793105],"sigma_pixels":1,"source_digest":"sha256:b6e634b032297f75e36e4724a89b1a6c7b678ca0aa3e0e14b657b79a82306822"}],"validation":[{"camera":1,"capture_interval_ns":["-8000000000","-8000000000"],"clock":10,"evidence_digest":"sha256:67f189987b9209da16ee05893b72179470848aee9badfafc1f297c5e63847d93","exposure":"synthetic:1:-8000000000:drift","pixel":[811.2941176470588,506.3529411764706],"sigma_pixels":1,"source_digest":"sha256:c9f188dbade5a7199b6ae673eacd3d6faa22cf5a02cf2bc278a7ea6f3a6b2381"},{"camera":1,"capture_interval_ns":["-4000000000","-4000000000"],"clock":10,"evidence_digest":"sha256:29d0136649698b917128ab2c19df084ce42ee189b05a3b90da11244015d85030","exposure":"synthetic:1:-4000000000:drift","pixel":[831.072463768116,502.2608695652174],"sigma_pixels":1,"source_digest":"sha256:718acfc8a917e9129a2ff796d128c709935c566fb924f96ebc7b1b28d02825c3"},{"camera":1,"capture_interval_ns":["0","0"],"clock":10,"evidence_digest":"sha256:3d5c2f951283930d4596a7f792c63d1b8d4d47727bb7afdcb0ca9fafc9e3a65a","exposure":"synthetic:1:0:drift","pixel":[850.2857142857142,498.2857142857143],"sigma_pixels":1,"source_digest":"sha256:a540277967e301dab73da1c841f54c17da83d0733d3f0a79a22b567fa6cf8baf"},{"camera":1,"capture_interval_ns":["4000000000","4000000000"],"clock":10,"evidence_digest":"sha256:65a0b1965cef6a6b1957f68b90fa67314ed220c37e2be43f80a5796557c8cb2e","exposure":"synthetic:1:4000000000:drift","pixel":[868.9577464788732,494.4225352112676],"sigma_pixels":1,"source_digest":"sha256:454651cb6e1c49252a3ab1a8adbdc00e78c69ebd0621c8da887e2848429a3d0b"},{"camera":1,"capture_interval_ns":["8000000000","8000000000"],"clock":10,"evidence_digest":"sha256:eadfe277ba1f59c1e25b28d12cf8d387c3a33b6e1f06f2e6cdd74aa79a5e776d","exposure":"synthetic:1:8000000000:drift","pixel":[887.1111111111111,490.6666666666667],"sigma_pixels":1,"source_digest":"sha256:551f63fab836ffc0b989b2b3e6d75bf5117040bd5a58d5835322dfe56cb52a30"},{"camera":2,"capture_interval_ns":["-7954000000","-7954000000"],"clock":20,"evidence_digest":"sha256:9f3c918f67b8ad135ae42ec238d6905b7073b8d02eda08fdd545216b09ffcb6a","exposure":"synthetic:2:-8000000000:drift","pixel":[434.8235294117647,412.2352941176471],"sigma_pixels":1,"source_digest":"sha256:77aab6ceec6c6760a8f239223deb53880ac09ef24e5951f5519c2b94149889ae"},{"camera":2,"capture_interval_ns":["-3952000000","-3952000000"],"clock":20,"evidence_digest":"sha256:72a056f72783f4438efdd32fc8040a2fe0b781131507945d93b65afd0cb3739e","exposure":"synthetic:2:-4000000000:drift","pixel":[460.05797101449275,409.5072463768116],"sigma_pixels":1,"source_digest":"sha256:f474c81f3972469d6fb779bb36d86abadd478e043f1418129e511e3388125e37"},{"camera":2,"capture_interval_ns":["50000000","50000000"],"clock":20,"evidence_digest":"sha256:df77ad6d4f0320b63ff8bfb3add6603665ed9bd9e79b8b23d6719ac6edb1b04d","exposure":"synthetic:2:0:drift","pixel":[484.57142857142856,406.8571428571429],"sigma_pixels":1,"source_digest":"sha256:9131bd377c1316a82922da487cb2691c96ad621b244c7b7620099b7144df992e"},{"camera":2,"capture_interval_ns":["4052000000","4052000000"],"clock":20,"evidence_digest":"sha256:6e479074be514167bc547b0f72c8f2181bffadf5eb57465a422bcdd417417c71","exposure":"synthetic:2:4000000000:drift","pixel":[508.3943661971831,404.28169014084506],"sigma_pixels":1,"source_digest":"sha256:7905d231ccb0754c9f8c23fb474aafafe6142116ef87277efbf5ba52e5932c58"},{"camera":2,"capture_interval_ns":["8054000000","8054000000"],"clock":20,"evidence_digest":"sha256:0d148da9f8816a0f7ecc465a8d3b1165c874304e41f8ef1c85fb0bb89c772577","exposure":"synthetic:2:8000000000:drift","pixel":[531.5555555555555,401.77777777777777],"sigma_pixels":1,"source_digest":"sha256:f4d46a24a3401c410f4cc6a4b6f79562f32eeaeb0a3d85bf4d79fa6560b1ea08"}],"world_basis":"sha256:dbd8fff30b14c13d7e63663409d112e81fbd94f8cde37911b2caf0f4fe9f5921"}
